No.,Title,Link
1,Take care of the environment: housing conditions affect the interplay of nutritional interventions and intestinal microbiota in broiler chickens,http://animalmicrobiome.biomedcentral.com/track/pdf/10.1186/s42523-019-0009-z
2,"Faecal inoculations alter the gastrointestinal microbiome and allow dietary expansion in a wild specialist herbivore, the koala",http://animalmicrobiome.biomedcentral.com/track/pdf/10.1186/s42523-019-0008-0
3,Impact of coccidiostat and phytase supplementation on gut microbiota composition and phytate degradation in broiler chickens,http://animalmicrobiome.biomedcentral.com/track/pdf/10.1186/s42523-019-0006-2
4,Correction to: Effect of the macroalgae Asparagopsis taxiformis on methane production and rumen microbiome assemblage,http://animalmicrobiome.biomedcentral.com/track/pdf/10.1186/s42523-019-0005-3
5,Effect of the macroalgae Asparagopsis taxiformis on methane production and rumen microbiome assemblage,http://animalmicrobiome.biomedcentral.com/track/pdf/10.1186/s42523-019-0004-4
6,Distinct microbiotas of anatomical gut regions display idiosyncratic seasonal variation in an avian folivore,http://animalmicrobiome.biomedcentral.com/track/pdf/10.1186/s42523-019-0002-6
7,Welcome to Animal Microbiome,http://animalmicrobiome.biomedcentral.com/track/pdf/10.1186/s42523-019-0003-5
