No.,Title,Link
1,Power converters for battery energy storage systems connected to medium voltage systems: a comprehensive review,http://bmcenergy.biomedcentral.com/track/pdf/10.1186/s42500-019-0006-5
2,Effects of nanoscale zerovalent cobalt on growth and photosynthetic parameters of soybean Glycine max (L.) Merr. DT26 at different stages,http://bmcenergy.biomedcentral.com/track/pdf/10.1186/s42500-019-0007-4
3,Modelling and optimization of a natural gas supply system at a transient stage: a case study of China,http://bmcenergy.biomedcentral.com/track/pdf/10.1186/s42500-019-0005-6
4,Waste to bioenergy: a review on the recent conversion technologies,http://bmcenergy.biomedcentral.com/track/pdf/10.1186/s42500-019-0004-7
5,Bioenergy utilization for a low carbon future in the UK: the evaluation of some alternative scenarios and projections,http://bmcenergy.biomedcentral.com/track/pdf/10.1186/s42500-019-0002-9
6,Enhanced economic feasibility of excess sludge treatment: acid fermentation with biogas production,http://bmcenergy.biomedcentral.com/track/pdf/10.1186/s42500-019-0001-x
7,BMC Energy: a home for all energy and fuels research,http://bmcenergy.biomedcentral.com/track/pdf/10.1186/s42500-019-0003-8
